{
    "output_dir": "processed",
    "adjust_longitude": true,
    "adjust_longitude_vname": "longitude",
    "adjust_longitude_fname": "adjlon",
    "convert_kelvin_to_celsius": true,
    "convert_kelvin_to_celsius_vname": "t2m",
    "convert_kelvin_to_celsius_fname": "celsius",
    "convert_m_to_mm_precipitation": true,
    "convert_m_to_mm_precipitation_vname": "tp",
    "convert_m_to_mm_precipitation_fname": "mm",
    "resample_grid": true,
    "resample_degree": 0.5,
    "resample_grid_vname": ["latitude", "longitude"],
    "resample_grid_fname": "deg_trim",
    "unify_coords": true,
    "unify_coords_fname": "unicoords",
    "uni_coords": {
        "valid_time": "time"
    },
    "cal_monthly_tp": false,
    "cal_monthly_tp_vname": "tp",
    "cal_monthly_tp_tcoord": "time",
    "cal_monthly_tp_fname": "montp"
}
